{
  "caseId": "c8f1e35c-7445-44db-94a0-711285d3a390",
  "caseRevision": 3,
  "contextRevision": 3,
  "handover": {
    "status": "digital",
    "revision": 2,
    "wantsHumanAdvisor": false,
    "leaveViewRequested": false,
    "stopDigitalConversation": false,
    "requestId": "72162e6f-1815-4f5b-bb6d-0fe9da9ece73",
    "requestedAt": "2026-10-31T13:06:49.480Z",
    "resumedAt": "2026-10-31T13:06:49.493Z",
    "source": "ui"
  },
  "contact": {
    "organization": "Pax",
    "kind": "public_general_contact",
    "phone": "+41612776666",
    "displayPhone": "+41 61 277 66 66",
    "sourceUrl": "https://www.pax.ch/de/kontakt-und-services",
    "verifiedAt": "2026-10-31",
    "automaticDialing": false,
    "advisorAssigned": false
  },
  "command": {
    "messageId": "digital_advice_explicitly_resumed",
    "action": "resume",
    "replayed": false,
    "changed": true
  }
}
